,author,title,description,url,urlToImage,publishedAt,content,source.id,source.name
70,Aaron Mamiit,The Alienware Aurora R16 with RTX 4090 is finally on sale again,"The Alienware Aurora R16 gaming PC is finally on sale from Dell again, with this configuration featuring the Nvidia GeForce RTX 4090 graphics card at $400 off.",https://www.digitaltrends.com/computing/alienware-aurora-r16-gaming-laptop-deal-march-2025/,https://www.digitaltrends.com/wp-content/uploads/2023/10/alienware-aurora-r16-review-14.jpg?resize=1200%2C630&p=1,2025-04-01T13:36:53Z,"It’s been several weeks since Dell included the powerful Alienware Aurora R16 in its gaming PC deals, but the wait ends here. This configuration featuring the Nvidia GeForce RTX 4090 graphics card us… [+1964 chars]",,Digital Trends
71,Jacob Ridley,This nearly budget gaming PC build made me realise availability is just as important as affordability when building a cheap machine,A budget part is only as good as its price on the shelf.,https://www.pcgamer.com/hardware/gaming-pcs/this-nearly-budget-gaming-pc-build-made-me-realise-availability-is-just-as-important-as-affordability-when-building-a-cheap-machine/,https://cdn.mos.cms.futurecdn.net/X35YkZgSiBkfyWc58bpvjn-1200-80.jpg,2025-04-01T13:20:10Z,"There have been some excellent budget PC parts released over the past couple of years. I'm not just talking about budget graphics cards, though we do finally have one of those, I'm also talking about… [+9913 chars]",,PC Gamer
72,dimitsev,Brightness flickering and thin horizontal stripes in Ubuntu 24.04 LTS,"On Ubuntu Desktop 24.04.2 LTS, my secondary screen's brightness flickers intensely at several Hertz. When that happens, there are also 100 thin, horizontal stripes superimposed on the image. (Honestly, idgaf about the stripes, just make the flickering stop...…",https://askubuntu.com/questions/1544931/brightness-flickering-and-thin-horizontal-stripes-in-ubuntu-24-04-lts,https://cdn.sstatic.net/Sites/askubuntu/Img/apple-touch-icon@2.png?v=c492c9229955,2025-04-01T13:18:47Z,"On Ubuntu Desktop 24.04.2 LTS, my secondary screen's brightness flickers intensely at several Hertz. When that happens, there are also 100 thin, horizontal stripes superimposed on the image. (Honestl… [+148 chars]",,Askubuntu.com
73,Soumya Eswaran,Sands Capital Select Growth Fund Sold Edwards Lifesciences Corporation (EW) For Better Opportunities,"Sands Capital, an investment management company, released its “Sands Capital Select Growth Fund” Q4 2024 investor letter. A copy of the same can be...",https://finance.yahoo.com/news/sands-capital-select-growth-fund-131821494.html,https://media.zenfs.com/en/insidermonkey.com/15397c90bc4c8a119b1941c60110e9a5,2025-04-01T13:18:21Z,"Sands Capital, an investment management company, released its Sands Capital Select Growth Fund Q4 2024 investor letter. A copy of the same can be downloaded here. Select Growth primarily targets U.S.… [+2727 chars]",,Yahoo Entertainment
74,Hassam Nasir,Retailer clarifies RTX 5090 'B-stock' listing with missing ROPs was a system error,"The above-MSRP ""B-stock"" RTX 5090 with missing ROPs that popped up on Alternate's web store a few days back was accidental and due to a system error.",https://www.tomshardware.com/pc-components/gpus/retailer-clarifies-rtx-5090-b-stock-listing-with-missing-rops-was-a-system-error,https://cdn.mos.cms.futurecdn.net/Ws3sVVcYLVhgyjT8RmwAUg-1200-80.jpg,2025-04-01T13:13:17Z,"German tech retailer Alternate has explained a controversial recent listing on its website for an RTX 5090 with missing ROPs. On the site it was classified as ""B-stock"" that, despite the apparent def… [+2940 chars]",,Tom's Hardware UK
75,Nauman khan,Morgan Stanley: Upcoming AI Conferences May Serve as a Catalyst for Tech Stocks,Tech Stocks Brace for Catalyst Events Amid AI Spending Concerns,https://finance.yahoo.com/news/morgan-stanley-upcoming-ai-conferences-131110586.html,https://media.zenfs.com/en/us.finance.gurufocus/ddef5d496e391f2aa87edf11fd2cbfd2,2025-04-01T13:11:10Z,April 1 - Investors' growing concerns over the sustainability of the artificial intelligence spending boom have weighed on tech stocks as the new year begins. Stocks such as Nvidia (NASDAQ:NVDA) have… [+1114 chars],,Yahoo Entertainment
76,,"Cerebras Systems, Ranovus win $45 million US military deal to speed up chip connections","SAN FRANCISCO : Cerebras Systems, a Silicon Valley-based AI chip company, and Canadian chip startup Ranovus said on Tuesday that they had been awarded a $45 million contract from the U.S. military to speed up connections between computing chips.Cerebras, whic…",https://www.channelnewsasia.com/business/cerebras-systems-ranovus-win-45-million-us-military-deal-speed-up-chip-connections-5037666,"https://dam.mediacorp.sg/image/upload/s--gGOxRcFD--/fl_relative,g_south_east,l_mediacorp:cna:watermark:2024-04:reuters_1,w_0.1/f_auto,q_auto/c_fill,g_auto,h_676,w_1200/v1/one-cms/core/2025-04-01t130800z_1_lynxnpel301ro_rtroptp_3_nvidia-malaysia.jpg?itok=EvzviGkK",2025-04-01T13:08:00Z,"SAN FRANCISCO : Cerebras Systems, a Silicon Valley-based AI chip company, and Canadian chip startup Ranovus said on Tuesday that they had been awarded a $45 million contract from the U.S. military to… [+1825 chars]",,CNA
77,Craig Hale,"New Intel CEO says company will spin off non-Core units, tells customers to ""be brutally honest with us""","Lip-Bu Tan reveals plans to point Intel back in the right direction, including spinning off non-core assets.",https://www.techradar.com/pro/new-intel-ceo-says-company-will-spin-off-non-core-units-tells-customers-to-be-brutally-honest-with-us,https://cdn.mos.cms.futurecdn.net/8zcrXFmwqGhotbwYirbJee-1200-80.jpg,2025-04-01T13:04:00Z,<ul><li>Intel CEO Lip-Bu Tan discusses the company’s future at its Vision conference</li><li>Spinning off non-core assets and adding more engineers are a priority</li><li>Tan wants to listen to custo… [+1942 chars],techradar,TechRadar
78,worldsavior,Show HN: Kai Scheduler – K8s scheduler optimizing GPU for AI,"Article URL: https://github.com/NVIDIA/KAI-Scheduler
Comments URL: https://news.ycombinator.com/item?id=43546270
Points: 1
# Comments: 0",https://github.com/NVIDIA/KAI-Scheduler,https://opengraph.githubassets.com/789bae0e1275138b9686a87f60b429d77b97a25359d70fd7552b63910b38ad06/NVIDIA/KAI-Scheduler,2025-04-01T12:59:31Z,"KAI Scheduler is a robust, efficient, and scalable Kubernetes scheduler that optimizes GPU resource allocation for AI and machine learning workloads.
Designed to manage large-scale GPU clusters, inc… [+2897 chars]",,Github.com
79,Soumya Eswaran,DexCom (DXCM) Slid on Poor Execution and GLP-1 Drug Disruption Concerns,"Sands Capital, an investment management company, released its “Sands Capital Select Growth Fund” Q4 2024 investor letter. A copy of the same can be...",https://finance.yahoo.com/news/dexcom-dxcm-slid-poor-execution-125913782.html,https://media.zenfs.com/en/insidermonkey.com/4c71d627871fc30b6a1611f138bf86ef,2025-04-01T12:59:13Z,"Sands Capital, an investment management company, released its Sands Capital Select Growth Fund Q4 2024 investor letter. A copy of the same can be downloaded here. Select Growth primarily targets U.S.… [+2156 chars]",,Yahoo Entertainment
80,"Siladitya Ray, Forbes Staff, 
 Siladitya Ray, Forbes Staff
 https://www.forbes.com/sites/siladityaray/",What To Know About The Switch 2 As Nintendo Readies Its First Console Launch In 8 Years,"The Mario-maker offered a sneak peek of its highly anticipated new console in January after a series of leaks, but the official detailed unveiling is set to take place Wednesday.",https://www.forbes.com/sites/siladityaray/2025/04/01/what-to-know-about-the-switch-2-as-nintendo-readies-its-first-console-launch-in-8-years/,"https://imageio.forbes.com/specials-images/imageserve/67ebe2b1c8a5b28326757c06/0x0.jpg?format=jpg&crop=1675,942,x0,y86,safe&height=900&width=1600&fit=bounds",2025-04-01T12:59:00Z,"Nintendo will give a first detailed look at the highly anticipated successor to its best-selling video game console of all timethe Switch 2on Wednesday, as the gaming industry braces for what could b… [+5279 chars]",,Forbes
81,,Navigating the Hybrid Work Dilemma,"Many organizational leaders believe remote work is here to stay. Others are requiring employees return to the workplace. But Prithriwaj “Raj” Choudhury, an associate professor at Harvard Business School, says it’s not a simple managerial choice between two op…",https://hbr.org/podcast/2025/04/navigating-the-hybrid-work-dilemma,https://hbr.org/resources/images/article_assets/2025/02/wide-ideacast_25.png,2025-04-01T12:52:54Z,"CURT NICKISCH: Welcome to the HBR IdeaCast from Harvard Business Review. I’m Curt Nickisch.
Remote work, especially hybrid work, exploded far and wide during the COVID-19 pandemic. In the past five … [+26245 chars]",,Harvard Business Review
82,Soumya Eswaran,What Makes Axon Enterprise (AXON) an Attractive Bet?,"Sands Capital, an investment management company, released its “Sands Capital Select Growth Fund” Q4 2024 investor letter. A copy of the same can be...",https://finance.yahoo.com/news/makes-axon-enterprise-axon-attractive-124917705.html,https://media.zenfs.com/en/insidermonkey.com/4d4a733e28e75e6d5e11be43199f33a1,2025-04-01T12:49:17Z,"Sands Capital, an investment management company, released its Sands Capital Select Growth Fund Q4 2024 investor letter. A copy of the same can be downloaded here. Select Growth primarily targets U.S.… [+3810 chars]",,Yahoo Entertainment
83,Soumya Eswaran,Sands Capital Select Growth Fund’s Investment Thesis for Roblox Corporation (RBLX),"Sands Capital, an investment management company, released its “Sands Capital Select Growth Fund” Q4 2024 investor letter. A copy of the same can be...",https://finance.yahoo.com/news/sands-capital-select-growth-fund-123326503.html,https://media.zenfs.com/en/insidermonkey.com/83c11f730bf382660bec748c969058b9,2025-04-01T12:33:26Z,"Sands Capital, an investment management company, released its Sands Capital Select Growth Fund Q4 2024 investor letter. A copy of the same can be downloaded here. Select Growth primarily targets U.S.… [+2611 chars]",,Yahoo Entertainment
84,Barry Ritholtz,Transcript: Michael Lewis on ‘Who is Government’,"﻿       The transcript from this week’s, MiB: Michael Lewis on ‘Who is Government’, is below. You can stream and download our full conversation, including any podcast extras, on Apple Podcasts, Spotify, YouTube, and Bloomberg. All of our earlier podcasts on y…",https://ritholtz.com/2025/04/transcript-michael-lewis-whoisgovt/,https://ritholtz.com/wp-content/uploads/2023/02/Mib-tile.png,2025-04-01T12:30:37Z,"The transcript from this weeks, MiB: Michael Lewis on ‘Who is Government’, is below.
You can stream and download our full conversation, including any podcast extras, on Apple Podcasts, Spotify, YouT… [+68152 chars]",,Ritholtz.com
85,Jeremy Laird,"Same plan, different CEO: Intel's Lip-Bu Tan laments 'past mistakes' while promising a brighter 'engineering focused' future",Show me the innovation!,https://www.pcgamer.com/hardware/processors/same-plan-different-ceo-intels-lip-bu-tan-laments-past-mistakes-while-promising-a-brighter-engineering-focused-future/,https://cdn.mos.cms.futurecdn.net/gywvJokCYFrGaCdJJFwopR-1200-80.png,2025-04-01T12:30:21Z,"Intel's new CEO, Lip-Bu Tan, leant heavily into the company's failures in his debut keynote performance at the Intel Vision 2025 event, yesterday. He also promised that the future would be brighter t… [+4397 chars]",,PC Gamer
86,Soumya Eswaran,Here’s Why JDP Capital Management is Excited About ENDI Corp (ENDI),"JDP Capital Management, an investment management company, released its fourth quarter 2024 investor letter. A copy of the letter can be downloaded here. 2024...",https://finance.yahoo.com/news/why-jdp-capital-management-excited-122620952.html,https://media.zenfs.com/en/insidermonkey.com/ff3f682c4ace80e1c2141baa36353dd0,2025-04-01T12:26:20Z,"JDP Capital Management, an investment management company, released its fourth quarter 2024 investor letter. A copy of the letter can be downloaded here. 2024 proved to be an excellent year for the ma… [+2005 chars]",,Yahoo Entertainment
87,finance.yahoo.com,"Tesla, Nvidia, CoreWeave, Calvin Klein parent PVH, XPeng: Stocks to watch today","In This Article:
Stock futures fell premarket on Tuesday ahead of President Donald Trump’s tariff announcement on Wednesday. Measures tied to the S&P 500, Nasdaq 100 and and the Dow Jones industrial average all signaled a slightly lower open as of 7:37 a.m.
I…",https://biztoc.com/x/c10ca1feb7b736fc,https://biztoc.com/cdn/c10ca1feb7b736fc_s.webp,2025-04-01T12:25:42Z,"In This Article:Stock futures fell premarket on Tuesday ahead of President Donald Trumps tariff announcement on Wednesday. Measures tied to the S&amp;P 500, Nasdaq 100 and and the Dow Jones industria… [+150 chars]",,Biztoc.com
88,finance.yahoo.com,"Meet the Hard Asset That's Bigger Than Apple, Nvidia, and Microsoft Combined. One Wall Street Strategist Thinks It Could Hit a $40 Trillion Market Cap","In This Article:
Shares of Apple, Nvidia, and Microsoft have exploded in recent years, as investors poured money into stocks that were best positioned to take advantage of the rise in artificial intelligence (AI). These three stocks grew so popular that their…",https://biztoc.com/x/af0c6689904224fc,https://biztoc.com/cdn/af0c6689904224fc_s.webp,2025-04-01T12:25:39Z,"In This Article:Shares of Apple, Nvidia, and Microsoft have exploded in recent years, as investors poured money into stocks that were best positioned to take advantage of the rise in artificial intel… [+138 chars]",,Biztoc.com
89,investors.com,Dow Jones Futures Fall Ahead Of Imminent Trump Tariffs; Newsmax IPO Surges,"The Dow Jones Industrial Average and other major stock indexes dropped Tuesday, as Wall Street braced for President Donald Trump's tariffs to go into effect Wednesday. Early movers included Newsmax (NMAX), Nvidia (NVDA) and Tesla (TSLA) on the stock market to…",https://biztoc.com/x/aed813eefe364ac1,https://biztoc.com/cdn/aed813eefe364ac1_s.webp,2025-04-01T12:25:34Z,"The Dow Jones Industrial Average and other major stock indexes dropped Tuesday, as Wall Street braced for President Donald Trump's tariffs to go into effect Wednesday. Early movers included Newsmax (… [+148 chars]",,Biztoc.com
90,,"Tesla, Nvidia, CoreWeave, Calvin Klein parent PVH, XPeng: Stocks to watch today",,https://consent.yahoo.com/v2/collectConsent?sessionId=1_cc-session_cd2a536d-1fef-4809-9dcd-d8921ef43197,,2025-04-01T12:10:39Z,"If you click 'Accept all', we and our partners, including 238 who are part of the IAB Transparency &amp; Consent Framework, will also store and/or access information on a device (in other words, use … [+702 chars]",,Yahoo Entertainment
91,,"Meet the Hard Asset That's Bigger Than Apple, Nvidia, and Microsoft Combined. One Wall Street Strategist Thinks It Could Hit a $40 Trillion Market Cap.",,https://consent.yahoo.com/v2/collectConsent?sessionId=1_cc-session_373c59a7-60bd-401b-acae-5605bb90ee4b,,2025-04-01T12:05:00Z,"If you click 'Accept all', we and our partners, including 238 who are part of the IAB Transparency &amp; Consent Framework, will also store and/or access information on a device (in other words, use … [+702 chars]",,Yahoo Entertainment
92,Soumya Eswaran,Here are JDP Capital Management’s Views on Tesla (TSLA),"JDP Capital Management, an investment management company, released its fourth quarter 2024 investor letter. A copy of the letter can be downloaded here. 2024...",https://finance.yahoo.com/news/jdp-capital-management-views-tesla-120447927.html,https://media.zenfs.com/en/insidermonkey.com/2f1bf47b64f185ad29af8e89f576d5c3,2025-04-01T12:04:47Z,"JDP Capital Management, an investment management company, released its fourth quarter 2024 investor letter. A copy of the letter can be downloaded here. 2024 proved to be an excellent year for the ma… [+2059 chars]",,Yahoo Entertainment
93,James Bentley,Inzoi and The First Berserker Khazan devs suggest ditching the latest Nvidia drivers if you're running an RTX 40-series graphics card,RTX 50-series can still update their drivers though.,https://www.pcgamer.com/hardware/graphics-cards/inzoi-and-the-first-beserker-khazan-devs-suggest-ditching-the-latest-nvidia-drivers-if-youre-running-an-rtx-40-series-graphics-card/,https://cdn.mos.cms.futurecdn.net/CxFEfnvv7DFrtbwBj83YQ8-1200-80.png,2025-04-01T12:04:27Z,"If you aren't one of the lucky customers to get their hands on RTX 50-series graphics card, and are stuck with something older, some popular game developers are warning against updating to the latest… [+2534 chars]",,PC Gamer
94,Soumya Eswaran,Spotify (SPOT) Rose 148% in 2024,"JDP Capital Management, an investment management company, released its fourth quarter 2024 investor letter. A copy of the letter can be downloaded here. 2024...",https://finance.yahoo.com/news/spotify-spot-rose-148-2024-120038786.html,https://media.zenfs.com/en/insidermonkey.com/2825e93123661ee897128b3440ef7e2b,2025-04-01T12:00:38Z,"JDP Capital Management, an investment management company, released its fourth quarter 2024 investor letter. A copy of the letter can be downloaded here. 2024 proved to be an excellent year for the ma… [+2266 chars]",,Yahoo Entertainment
95,Tanveer Singh,High-end gaming doesn't need high-end GPUs anymore,Mid-range cards are now offering a high-end gaming experience,https://www.xda-developers.com/high-end-gaming-doesnt-need-high-end-gpu/,https://static1.xdaimages.com/wordpress/wp-content/uploads/wm/2025/03/rtx-5090-connector.jpg,2025-04-01T12:00:38Z,"I'd be lying if I said I never wished to have an RTX 4090 (or a 4080 Super) in my gaming PC. In fact, I was sure I'd upgrade from my RTX 3080 to the RTX 5080 this year, but that dream stands ruined f… [+9779 chars]",,XDA Developers
96,Dashia Milden,"70% of Gen Z and Millennial Gamers Are Ready to Purchase a Switch 2, CNET Survey Finds",Gen Z gamers spend nearly $700 a year on new games and subscriptions. And they're looking forward to the new Switch model the most.,https://www.cnet.com/tech/gaming/nintendo-switch-2-survey/,https://www.cnet.com/a/img/resize/67e67c30f14280c860b08963c6ca4a5a704ba5bd/hub/2025/03/31/3009bd63-31a1-4dec-aed5-4b63b3fe7408/switch2.png?auto=webp&fit=crop&height=675&width=1200,2025-04-01T12:00:00Z,"The time has finally come for a new Nintendo console. Eight years after the launch of the original Nintendo Switch, the storied gaming company will release details on its highly anticipated successor… [+10000 chars]",,CNET
97,investors.com,"Nvidia, Other Techs Hurt Dow Jones, But These Names Outperformed In Q1","Since it joined the Dow industrials on Nov. 7, Nvidia stock is down nearly 30%.
The post Nvidia, Other Techs Hurt Dow Jones, But These Names Outperformed In Q1 appeared first on Investor's Business Daily.",https://biztoc.com/x/a5e24545fd302de7,https://biztoc.com/cdn/928/og.png,2025-04-01T11:51:40Z,"Since it joined the Dow industrials on Nov. 7, Nvidia stock is down nearly 30%.The post Nvidia, Other Techs Hurt Dow Jones, But These Names Outperformed In Q1 appeared first on Investor's Business Da… [+63 chars]",,Biztoc.com
98,Stefan Mileschin,AMD cosies up to Rapt AI to claw into Nvidias turf,"Underdog chipmaker AMD is teaming up with Rapt AI in a strategic move to boost performance on its Instinct GPU lineup and tackle the AI infrastructure headaches that have plagued would-be innovators.

https://fudzilla.com/news/60787-amd-cosies-up-to-rapt-ai-t…",http://www.madshrimps.be/news/item/238136,,2025-04-01T11:51:04Z,"Copyright © 2001-2011 Madshrimps, All rights reserved.Graphic Design by Dennis Kestelle, Programming by Maarten Menten,
Overall Site design by John Meys
All information and graphics contained in Ma… [+135 chars]",,Madshrimps.be
99,benzinga.com,5 Stock Picks Last Month From Wall Street's Most Accurate Analysts,"U.S. stocks settled mixed on Monday, with the Dow Jones index gaining more than 400 points during the session as investors assessed President Donald Trump's tariff plans. However, the Nasdaq settled lower on Monday as shares of Nvidia Corp. (NASDAQ:NVDA) fell…",https://biztoc.com/x/d0c0ae04511205d0,https://biztoc.com/cdn/d0c0ae04511205d0_s.webp,2025-04-01T11:40:40Z,"U.S. stocks settled mixed on Monday, with the Dow Jones index gaining more than 400 points during the session as investors assessed President Donald Trump's tariff plans. However, the Nasdaq settled … [+138 chars]",,Biztoc.com
